{
  "$schema": "http://json-schema.org/draft-07/schema#",
  "definitions": {
    "BoothTag": {
      "type": "string",
      "description": "boothTagSchema (z.enum)",
      "enum": [
        "game/experience",
        "attraction",
        "food",
        "exhibition",
        "performance",
        "movie",
        "store",
        "magazine"
      ]
    },
    "BoothColor": {
      "type": "string",
      "description": "boothColorSchema (z.enum)",
      "enum": [
        "red",
        "blue",
        "yellow_green",
        "green",
        "purple",
        "orange",
        "random"
      ]
    },
    "PlaceId": {
      "type": "string",
      "description": "placeIdSchema (z.enum)",
      "enum": [
        "gym1",
        "m1a/m1b",
        "m2a/m2b/m2c/m2d",
        "h3a",
        "h3b",
        "h3c",
        "h3d",
        "ground",
        "sp3",
        "h2b/h2c",
        "m3c",
        "m3d",
        "spj4",
        "science",
        "catholic",
        "theater",
        "biology",
        "h2d",
        "sp2",
        "h1c/h1d",
        "tech",
        "sp5",
        "h2a",
        "sp4",
        "physics",
        "h3e",
        "music",
        "large/sp1",
        "m3b",
        "?",
        "sp6",
        "gym2",
        "m1c/m1d",
        "meeting",
        "shodo",
        "m3a"
      ]
    }
  },
  "type": "object",
  "title": "Booth",
  "description": "boothSchema (z.object)",
  "required": [
    "booth_id",
    "booth_name",
    "short_description",
    "long_description",
    "tags",
    "color",
    "has_cm",
    "has_website",
    "group_name",
    "place_id",
    "place",
    "overview"
  ],
  "properties": {
    "booth_id": {
      "type": "string"
    },
    "booth_name": {
      "type": "string"
    },
    "short_description": {
      "type": "string"
    },
    "long_description": {
      "type": "string"
    },
    "tags": {
      "type": "array",
      "items": {
        "$ref": "#/definitions/BoothTag"
      }
    },
    "color": {
      "$ref": "#/definitions/BoothColor"
    },
    "has_cm": {
      "type": "boolean"
    },
    "has_website": {
      "type": "boolean"
    },
    "group_name": {
      "type": "string"
    },
    "place_id": {
      "$ref": "#/definitions/PlaceId"
    },
    "place": {
      "type": "string"
    },
    "overview": {
      "type": "string"
    },
    "not-cpmplete": {
      "type": "boolean"
    }
  },
  "additionalProperties": false
}