{
  "$schema": "../booth-schema.json",
  "booth_id": "club-12",
  "booth_name": "星光グラフ",
  "short_description": "部員撮影の写真の展示とグッズ販売、50枚限定の合格祈願チェキ撮影会を行います。ぜひお越しください！",
  "long_description": "写真部ではさまざまな趣味を持つ部員が撮影した写真の展示やカレンダー、ステッカーなどの物販、50枚限定の合格祈願チェキの撮影会(無くなり次第終了)を行います。写真の魅力を多彩に楽しめるブースへ是非お越しください！",
  "tags": ["exhibition", "store"],
  "color": "random",
  "has_cm": false,
  "has_website": true,
  "group_name": "写真部",
  "place_id": "spj4",
  "place": "中学４F特別",
  "overview": "写真展示・販売・撮影"
}
