{
  "booth_id": "class-m3b",
  "booth_name": "フリースロー",
  "short_description": "ボールを投げて、ゴールを狙おう！近距離・中距離・遠距離の3つの距離から選べます。入った数に応じて景品があるよ。来てね",
  "long_description": "バスケが得意じゃなくても大丈夫！近距離・中距離・遠距離の3つの距離から選べます。気軽にボールを投げてゴールを狙ってみよう！入った数に応じて景品も用意しているよ。ぜひ気軽に立ち寄ってチャレンジしてみてね。お待ちしています！",
  "tags": ["game/experience"],
  "color": "random",
  "has_cm": true,
  "has_website": true,
  "group_name": "M3B",
  "place_id": "h3b",
  "place": "H3B",
  "overview": "フリースロー"
}
