{
  "$schema": "../booth-schema.json",
  "booth_id": "club-10",
  "booth_name": "んけうすproject2025",
  "short_description": "毎年恒例の部員が作ったゲームを販売する企画です。無料でも遊べるので、ぜひ寄って行ってください！※今年は数学はありません。",
  "long_description": "部員が作ったＰＣゲームを遊べます！！アクションゲームとかバトルシミュレーターゲームとかあります！！ＣＤを買えば家でも遊べます！！（激安）楽しいはずなので来てください！！！…え？数学の問題を解く企画は？チョットナニイッテルカワカラナイデス…",
  "tags": ["game/experience", "store", "magazine"],
  "color": "blue",
  "has_cm": true,
  "has_website": true,
  "group_name": "数学研究部",
  "place_id": "m3c",
  "place": "M3C",
  "overview": "PCゲームの展示販売"
}
