{
    "booth_id": "volu-17",
    "booth_name": "星光生ラップバトル選手権",
    "short_description": "星光生のなんたるか。それは歌詞にない本心を歌う時に現れる。上原先生含む4MCの即興ラップで会場沸騰待ったなし！！",
    "long_description": "文化祭初企画！即興ラップバトル開催！リズムに乗せた言葉とフローが交差し、瞬間ごとに新たな表現が飛び出す。誰がどんな言葉で場を沸かすのかが醍醐味！観客の皆さん全員の挙手と声援で勝敗を決する唯一無二の熱きステージを体感せよ！",
    "tags": [
        "performance"
    ],
    "color": "random",
    "has_cm": false,
    "has_website": true,
    "group_name": "星光生ラップ選手権",
    "place_id": "gym1",
    "place": "講堂",
    "overview": "ラップ(バンド)"
}