{
  "$schema": "../booth-schema.json",
  "booth_id": "class-h2b",
  "booth_name": "空中鞦韆",
  "short_description": "企画名よめましたか？空中ブランコ、そうあの空中ブランコです！クラス一丸で作り上げた空中ブランコ。是非乗ってみてください！",
  "long_description": "名前の漢字、読み方わかりましたか？これは空中ブランコ、そうあの空中ブランコです！これは怖さ控えめ空中ブーランコ。見た目はショボいと思うかもしれない」でもクラス一丸で作った空中ブランコ！ぜひこの機会に乗ってみては？",
  "tags": ["attraction"],
  "color": "yellow_green",
  "has_cm": false,
  "has_website": true,
  "group_name": "H2B",
  "place_id": "sp3",
  "place": "特３",
  "overview": "空中ブランコ"
}
