{
    "booth_id": "club-08",
    "booth_name": "たこやき",
    "short_description": "高校バスケ部が作る、外はカリカリ、中はふわふわのたこ焼き！ほっぺが落ちるほどの美味しさです。ぜひ、来てね",
    "long_description": "高校バスケ部が作る、外はカリカリ、中はふわふわのたこ焼き！ほっぺが落ちるほどの美味しさで、その破壊力はまるで八村塁のダンクのよう。6個で200円という手頃に買える値段なので、ぜひ食べに来てください！！",
    "tags": [
        "food"
    ],
    "color": "random",
    "has_cm": false,
    "has_website": true,
    "group_name": "高校バスケ部",
    "place_id": "ground",
    "place": "グラウンド",
    "overview": "たこ焼き"
}