{
  "$schema": "../booth-schema.json",
  "booth_id": "grade-2b",
  "booth_name": "75Kといっしょ",
  "short_description": "私達中2は、ゲームコーナー、迷路、中2が小学生に教える体験授業の3つをします！文武両道といえばここしか勝たん！ぜひ来てください！",
  "long_description": "私達中2は、3つの企画をやります。1つ目はみんな楽しいゲームコーナー、2つ目は選ばれし者たちが作った迷路、そして3つ目は中2が小学生に教える体験授業です！文武両道といえばここしか勝たん！ぜひ来てください！",
  "tags": ["game/experience", "performance", "store"],
  "color": "random",
  "has_cm": false,
  "has_website": true,
  "group_name": "中２学年",
  "place_id": "m2a/m2b/m2c/m2d",
  "place": "M2A,M2B,M2C,M2D",
  "overview": "迷路、ゲーム、授業"
}
