{
  "$schema": "../booth-schema.json",
  "booth_id": "club-07",
  "booth_name": "ほっけいぽていと",
  "short_description": "ホッケー部の作る外カリ中ほくの超美味しいフライドポテトを\\nぜひ皆さん食べに来てください！グラウンドで待ってます！",
  "long_description": "ホッケー部の作る外カリ中ほくの超美味しいフライドポテト。塩とケチャャッぷの他にも様々な味付けを用意しています！コスパ最高で気に入ってもらえる事間違い無しです！\\nぜひ皆さん食べに来てくださいね♪グラウンドで待ってます！",
  "tags": ["food"],
  "color": "random",
  "has_cm": false,
  "has_website": true,
  "group_name": "ホッケー部",
  "place_id": "ground",
  "place": "グラウンド",
  "overview": "フライドポテト"
}
