{
  "$schema": "../booth-schema.json",
  "booth_id": "volu-15",
  "booth_name": "漫才Ⅲ",
  "short_description": "今年3年目の漫才！去年は多数出場し一番の盛り上がりを見せました。そして今回も更に進化させてお届けします！是非！！",
  "long_description": "星光での漫才の歴史は浅く、今年で3年目！しかし、歴史など関係ありません。去年は講堂企画では一番の盛り上がりを見せました。そんな中で今年は更にレベルアップしてお届けします。去年の優勝者も参加するハイレベルな戦い間違いなし！絶対来てな！！",
  "tags": ["performance"],
  "color": "random",
  "has_cm": true,
  "has_website": true,
  "group_name": "漫才Ⅲ",
  "place_id": "gym1",
  "place": "講堂",
  "overview": "漫才"
}
