{
    "booth_id": "volu-04",
    "booth_name": "漢字テスト",
    "short_description": "星光生の漢字力に挑戦！レベル分けされているので老若男女幅広い世代が楽しめます。漢字力に自信のある人はぜひお越しを。",
    "long_description": "SFも遊んでばかりではいられない。受験を視野に入れている人や、漢字力に自信のある人は星光生の漢字力に挑戦してみよう。レベル分けされているので、老若男女幅広い世代が楽しめます。空いた時間に是非お越しを。",
    "tags": [
        "exhibition",
        "store"
    ],
    "color": "random",
    "has_cm": false,
    "has_website": true,
    "group_name": "言語同好会(日本語班)",
    "place_id": "?",
    "place": "一般教室",
    "overview": "漢字テスト"
}