{
    "booth_id": "volu-05",
    "booth_name": "謎グルイ",
    "short_description": "ここで開催される様々な「ゲーム」には「必勝法」がある。至高のひらめきで謎を解き明かし、難攻不落のゲームを打ち破れ！",
    "long_description": "ここでは様々なゲームが開催されています。きっと一筋縄ではクリアすることが出来ないでしょう。そこで、「謎解き」をご用意いたしました。謎を解けばクリアするための手がかりが手に入ります。ぜひ、あなたのひらめきでゲームクリアを目指してください。",
    "tags": [
        "game/experience",
        "store"
    ],
    "color": "red",
    "has_cm": true,
    "has_website": true,
    "group_name": "AH!Astery",
    "place_id": "sp6",
    "place": "特6",
    "overview": "謎解き"
}