{
  "booth_id": "club-26",
  "booth_name": "PK",
  "short_description": "他のところとは比べ物にならない超豪華景品の数々！！！あなたはサッカー部相手に何点決められる？？ぜひお待ちしています！",
  "long_description": "他のところとは比べ物にならない超豪華景品の数々！！！あなたはサッカー部相手に何点決められる？？ぜひ一度腕試しにお越しください！！\\n高校棟第2体育館でサッカー部の占いのもおすすめで〜す。ぜひお越しくださいまし～",
  "tags": ["game/experience"],
  "color": "random",
  "has_cm": false,
  "has_website": true,
  "group_name": "サッカー部",
  "place_id": "ground",
  "place": "グラウンド",
  "overview": "PK"
}
