{
  "$schema": "../booth-schema.json",
  "booth_id": "grade-2a",
  "booth_name": "中2合唱",
  "short_description": "中2のクラス合唱です。合宿や音楽の授業、LHRで練習しました。ボーイソプラノや男性ならではの低音をお楽しみください！",
  "long_description": "中学2年生もクラス合唱をやります。山荘や南部学舎、音楽の授業、LHRの時間を使って練習しました。美しいボーイソプラノや頼りがいのある低音が見どころとなっています。ぜひお立ち寄りいただき、楽しんでいってください！お待ちしております。",
  "tags": [
    "performance"
  ],
  "color": "random",
  "has_cm": false,
  "has_website": true,
  "group_name": "中２合唱",
  "place_id": "gym1",
  "place": "講堂",
  "overview": "合唱"
}