{
  "booth_id": "club-02",
  "booth_name": "いてまえ焼きそば",
  "short_description": "香ばしいソースの香りと迫力あるある鉄板さばきで、お腹も心も満たされること間違いなし！是非足を運んでみてください。",
  "long_description": "今日はグラウンドじゃなく鉄板で勝負だ！活気あふれる野球部が、熱気いっぱいに焼きそばをお届けします。香ばしいソースの香りと迫力ある鉄板さばきで、お腹も心も満たされること間違いなし。ぜひ足を運んでみてください！",
  "tags": ["food"],
  "color": "random",
  "has_cm": false,
  "has_website": true,
  "group_name": "高校野球部",
  "place_id": "ground",
  "place": "グラウンド",
  "overview": "やきそば"
}
