{
  "$schema": "../booth-schema.json",
  "booth_id": "club-23",
  "booth_name": "みんなで早押し&ペーパークイズ",
  "short_description": "高校生クイズ2025準決勝進出。ペーパークイズと早押しクイズを無料でやってます。高校生クイズ体験記込みの部誌は50円。",
  "long_description": "高校生クイズ2025準決勝進出の実績ある部活です。ペーパークイズと早押しクイズを無料でやってます。今までに身につけた知識を最大限に活用して、問題を攻略しましょう！初心者大歓迎です！部誌には高校生クイズ体験記を書いてます。50円。",
  "tags": ["game/experience", "magazine"],
  "color": "random",
  "has_cm": false,
  "has_website": true,
  "group_name": "クイズ研究会",
  "place_id": "sp4",
  "place": "特４",
  "overview": "クイズ"
}
