{
  "$schema": "../booth-schema.json",
  "booth_id": "volu-07",
  "booth_name": "惑惑文藝部～綺談遊戯に集うものたち～",
  "group_name": "文芸部",
  "place_id": "h3e",
  "overview": "短編映画",
  "place": "H3E",
  "long_description": "中世の劇作家が愛したアナログゲームを開催中！勝てば豪華景品がもらえるかも！？文芸部員が書き下ろした部誌も販売中です！",
  "short_description": "中世の劇作家が愛したアナログゲームを開催中！勝てば豪華景品がもらえるかも！？文芸部員が書き下ろした部誌も販売中です！",
  "color": "random",
  "has_cm": false,
  "has_website": false,
  "tags": ["game/experience", "store", "movie", "magazine"]
}
