{
  "booth_id": "class-h2d",
  "booth_name": "麺屋　あなたとまざりたいんです",
  "short_description": "断言します。老若男女問わず、これを食べたあなたは絶対癖になる。個性が強すぎるみんなで作った至極の一杯をぜひご賞味あれ。",
  "long_description": "個性が強すぎるメンバーでタレを作ったら、すんごいうまいタレができちゃいました！トッピングが豊富すぎて、これには他のラーメン屋もびっくり！？食べる時はよく混ぜてくださいね。さあ僕たちと一緒にまざりましょう。",
  "tags": ["food"],
  "color": "orange",
  "has_cm": false,
  "has_website": true,
  "group_name": "H2D",
  "place_id": "ground",
  "place": "グラウンド",
  "overview": "まぜそば"
}
