{
  "booth_id": "grade-1a",
  "booth_name": "中1合唱",
  "short_description": "この日のためにクラス一丸となって練習してきました。私たちの歌声が、聴いてくださる皆さんの心に温かく響きますように。",
  "long_description": "初めてのスクールフェア、中学1年生が心を込めて合唱をお届けします。この日のためにクラス一丸となって練習してきました。私たちの歌声が、聴いてくださる皆さんの心に温かく響きますように。精一杯の歌いたいと思います！",
  "tags": ["performance"],
  "color": "random",
  "has_cm": false,
  "has_website": true,
  "group_name": "中１合唱",
  "place_id": "gym1",
  "place": "講堂",
  "overview": "合唱"
}
