{
  "booth_id": "club-25",
  "booth_name": "スーパーボールすくい",
  "short_description": "那須与一は一矢で敵船の扇を射抜いてみせたと言われます。この企画も、あなたの胸の内をひょうと射抜いて見せましょう。",
  "long_description": "\"好く\"人は\"好く\"スーパーボール\"すく\"いというやつです。SF （\"スク\"ールフェア）に\"巣食\"うスーパーボール屋に集い\"すくすく\"売り上げを成長させて店員の出資金を\"救\"いましょう。すくったボールは\"すぐ\"お持ち帰りいただけます。胸の\"空く\"ような思い出を貴方に。\\n※字数については連絡欄参照",
  "tags": ["game/experience"],
  "color": "random",
  "has_cm": true,
  "has_website": true,
  "group_name": "弓道部",
  "place_id": "ground",
  "place": "グラウンド",
  "overview": "スーパーボールすくい"
}
