{
  "$schema": "../booth-schema.json",
  "booth_id": "club-30",
  "booth_name": "合唱部",
  "group_name": "合唱部",
  "place": "音楽室",
  "place_id": "music",
  "overview": "合唱",
  "color": "random",
  "has_cm": false,
  "has_website": false,
  "tags": ["performance"],
  "long_description": "放課後、教室に響く熱唱の声。青春の汗と魂がここにある——奇跡の美声、開演！音楽室でお待ちしております！！！！！！！！",
  "short_description": "放課後、教室に響く熱唱の声。青春の汗と魂がここにある——奇跡の美声、開演！音楽室でお待ちしております！！！！！！！！"
}
