{
  "$schema": "../booth-schema.json",
  "color": "red",
  "booth_id": "volu-19",
  "long_description": "バイオリンを2人で演奏します！演奏する曲は2つのバイオリンのための協奏曲です。息ぴったりの演奏をぜひ聴きに来てください！まるで会話しているかのように聞こえる、バイオリンの掛け合いの部分が最高の聞きどころです。",
  "short_description": "バイオリンを2人で演奏します！息ぴったりの演奏をぜひ聴きに来てください！弾く曲は、二つのバイオリンのための協奏曲です。",
  "tags": [],
  "has_website": false,
  "has_cm": false,
  "booth_name": "Violingual",
  "group_name": "福富・鈴木によるバイオリンスペシャルコンサート",
  "overview": "バイオリン",
  "place_id": "music",
  "place": "音楽室"
}
