{
  "$schema": "../booth-schema.json",
  "booth_id": "club-22",
  "booth_name": "囲碁将棋部",
  "short_description": "※囲碁はありません。部員との対局(50円)、部誌の販売(50円)を行っています。将棋を指したい方は是非お立ち寄りください",
  "long_description": "※囲碁はありません！部員との対局はもちろん、部員が製作した部誌も販売しています。腕に自信がある人も、初心者の方も大歓迎です！少しでも興味のある方は、是非囲碁将棋部へお越しください！高校棟三階、高二Aの教室でお待ちしております。",
  "tags": ["game/experience", "magazine"],
  "color": "random",
  "has_cm": false,
  "has_website": true,
  "group_name": "囲碁将棋部",
  "place_id": "h2a",
  "place": "H2A",
  "overview": "将棋"
}
