{
  "$schema": "../booth-schema.json",
  "booth_id": "volu-18",
  "booth_name": "K-コジバンド",
  "short_description": "K-コジバンドは某数学教師のロマンチックなピアノに高2のサックスとヴァイオリンが加わった心安らぐ曲を奏でるつもりです。",
  "long_description": "こんにちは。K-コジバンドです。このバンドは某数学教師のK先生と仲良しな72Kの音楽担当2人が組んだトリオバンドです。T-saxとヴァイオリンとピアノで誰もが聞いたことのある曲を演奏します。生徒と教師の織り成すハーモニーをお楽しみください！",
  "tags": [
    "performance"
  ],
  "color": "random",
  "has_cm": false,
  "has_website": true,
  "group_name": "先生と生徒のジャズ",
  "place_id": "gym1",
  "place": "講堂",
  "overview": "ジャズ演奏(バンド)"
}